pregunta,respuesta
¿Qué hago si mi computadora no enciende?,"Verifica que esté conectada a la corriente, prueba otro enchufe y revisa el botón de encendido."
¿Cómo soluciono un sobrecalentamiento del equipo?,"Asegúrate de que los ventiladores funcionen, limpia el polvo y considera usar una base de enfriamiento."
¿Por qué mi impresora no responde?,"Revisa las conexiones, asegúrate de que esté encendida y reinstala los controladores si es necesario."
¿Qué significa si escucho pitidos al encender la PC?,Los pitidos indican errores; consulta el manual de tu placa base para interpretar el patrón.
"¿Mi disco duro hace ruidos extraños, qué hago?",Haz un respaldo inmediato si es posible y lleva el disco a un técnico; podría fallar pronto.
¿Cómo limpio el polvo de mi computadora?,"Apaga el equipo, abre la carcasa y usa aire comprimido para limpiar suavemente el interior."
¿Qué hago si el monitor no muestra imagen?,"Revisa el cable, prueba otro monitor o puerto, y asegúrate de que la tarjeta gráfica esté bien conectada."
¿Cómo saber si la memoria RAM está fallando?,Utiliza herramientas como MemTest86 o cambia temporalmente los módulos para identificar errores.
"¿El teclado dejó de funcionar, qué hago?","Verifica la conexión, prueba otro puerto USB y reinicia el equipo; si no responde, intenta otro teclado."
¿Cómo prevenir daños por subidas de voltaje?,Usa un regulador de voltaje o UPS para proteger el equipo ante picos de corriente.
